Product Title,Product Price,Product Asin,Product URL
"Canon Genuine Toner, Cartridge 054 Black, High Capacity (3028C001) 1 Pack Color imageCLASS MF641Cdw, MF642Cdw, MF644Cdw, LBP622Cdw Laser Printer, Black High Capacity",$55.28,B07QFYHY72,https://www.amazon.com/Canon-Toner-Cartridge-054-imageCLASS/dp/B07QFYHY72/ref=sr_1_292?m=A3DQZEP4SGW5UA&qid=1699704081&s=merchant-items&sr=1-292
Mobil 1 M1-102A Extended Performance Oil Filter,$55.28,B071HCB8PC,https://www.amazon.com/Mobil-M1-102A-Extended-Performance-Filter/dp/B071HCB8PC/ref=sr_1_293?m=A3DQZEP4SGW5UA&qid=1699704081&s=merchant-items&sr=1-293
"Scepter 06792 14 Gallon Flo-N-Go Duramax Gasoline 14 Gallon Portable Gas Fuel Tank Container with Fluid Transfer Siphon Pump Fuel Caddy, Red",$55.28,B000MT94QA,https://www.amazon.com/Scepter-6792-Duramax-Gallon-Flo-N-Go/dp/B000MT94QA/ref=sr_1_294?m=A3DQZEP4SGW5UA&qid=1699704081&s=merchant-items&sr=1-294
"Canon Ink Canon CL-261XL Amr Printer Ink, Extra Large, Multi",$55.28,B07W3QCS6Z,https://www.amazon.com/Canon-CL-261XL-Printer-Extra-Large/dp/B07W3QCS6Z/ref=sr_1_295?m=A3DQZEP4SGW5UA&qid=1699704081&s=merchant-items&sr=1-295
Camco Sidewinder 10-Ft Camper/RV Sewer Hose Support | Telescoping Design Flexes Around Obstacles & Deep Cradles Secure Sewer Hose | Out-of-the-Box Ready & Folds for RV Storage and Organization (43031),$55.28,B000EDQQJ2,https://www.amazon.com/Camco-Feet-43031-Sidewinder-Support-10/dp/B000EDQQJ2/ref=sr_1_296?m=A3DQZEP4SGW5UA&qid=1699704081&s=merchant-items&sr=1-296
Elementa Silver - Adult Mouth Rinse 20 fl oz. - Wintermint,$55.28,B0887PFMM4,https://www.amazon.com/Elementa-Silver-Nanosilver-Adult-Wintermint/dp/B0887PFMM4/ref=sr_1_297?m=A3DQZEP4SGW5UA&qid=1699704081&s=merchant-items&sr=1-297
"Logitech Pebble Wireless Mouse with Bluetooth or 2.4 GHz Receiver, Silent, Slim Computer Mouse with Quiet Clicks, for Laptop/Notebook/iPad/PC/Mac/Chromebook - Pink Rose",$55.28,B07X5GHZYJ,https://www.amazon.com/Logitech-Pebble-Wireless-Mouse-Bluetooth/dp/B07X5GHZYJ/ref=sr_1_298?m=A3DQZEP4SGW5UA&qid=1699704081&s=merchant-items&sr=1-298
Crucial X6 1TB Portable SSD - Up to 800MB/s - PC and Mac - USB 3.2 USB-C External Solid State Drive - CT1000X6SSD9,$55.28,B08FSZT2J7,https://www.amazon.com/Crucial-1TB-Portable-SSD-CT1000X6SSD9/dp/B08FSZT2J7/ref=sr_1_299?m=A3DQZEP4SGW5UA&qid=1699704081&s=merchant-items&sr=1-299
StarTech.com USB 3.0 to HDMI Adapter - 1080p (1920x1200) - Slim/Compact USB Type-A to HDMI Display Adapter Converter for Monitor - External Video & Graphics Card - Black - Windows Only (USB32HDES),$55.28,B00H91BQ7Y,https://www.amazon.com/StarTech-com-USB-HDMI-Adapter-External/dp/B00H91BQ7Y/ref=sr_1_300?m=A3DQZEP4SGW5UA&qid=1699704081&s=merchant-items&sr=1-300
"Brother Genuine High Yield Black Ink Cartridge, LC75BK, Replacement Black Ink, Page Yield Up to 600 Pages, LC75",$55.28,B004HIQ6IG,https://www.amazon.com/Brother-Genuine-Cartridge-LC75BK-Replacement/dp/B004HIQ6IG/ref=sr_1_301?m=A3DQZEP4SGW5UA&qid=1699704081&s=merchant-items&sr=1-301
"Winsome Wood Henry Accent Table, Black, 19 inches",$55.28,B000NPTUGM,https://www.amazon.com/Winsome-Wood-20115-Henry-Accent/dp/B000NPTUGM/ref=sr_1_302?m=A3DQZEP4SGW5UA&qid=1699704081&s=merchant-items&sr=1-302
Nylabone Chew & Treat Toy for Dogs - Interactive Dog Enrichment Chew & Treat Toys,$55.28,B0828NM6XV,https://www.amazon.com/Nylabone-Extreme-Chewing-Knuckle-Chicken/dp/B0828NM6XV/ref=sr_1_303?m=A3DQZEP4SGW5UA&qid=1699704081&s=merchant-items&sr=1-303
"Elite Gourmet EDF-401T Electric Immersion Deep Fryer 3-Baskets, 1700-Watt, Timer Control, Adjustable Temperature, Lid with Viewing Window and Odor Free Filter, Stainless Steel and Black",$55.28,B00N9TPNNI,https://www.amazon.com/EDF-401T-Maxi-Matic-1700-Watt-Stainless-Steel-Temperature/dp/B00N9TPNNI/ref=sr_1_304?m=A3DQZEP4SGW5UA&qid=1699704081&s=merchant-items&sr=1-304
Women's Slip Style Fishnet Mini Dress and Matching G-String,$13.08,B001MXGXKU,https://www.amazon.com/Elegant-Moments-Fishnet-Matching-G-String/dp/B001MXGXKU/ref=sr_1_305?m=A3DQZEP4SGW5UA&qid=1699704095&s=merchant-items&sr=1-305
Coquette Footless Fishnet W/rhinestone Pantyhose Black O/s,$13.08,B0841NZRJB,https://www.amazon.com/Coquette-Footless-Fishnet-rhinestone-Pantyhose/dp/B0841NZRJB/ref=sr_1_306?m=A3DQZEP4SGW5UA&qid=1699704095&s=merchant-items&sr=1-306
