Product Title,Product Price,Product Asin,Product URL
"Petrodex Toothpaste for Dogs and Puppies, Cleans Teeth and Fights Bad Breath, Reduces Plaque and Tartar Formation, Enzymatic Toothpaste, Peanut Flavor, 2.5oz",$36.61,B007BU73PC,https://www.amazon.com/Petrodex-Natural-Toothpaste-Dog-Peanut/dp/B007BU73PC/ref=sr_1_192?m=A3DQZEP4SGW5UA&qid=1699704047&s=merchant-items&sr=1-192
"Aqueon Aquarium Fish Tank Preset Heater For Up To 40 Gallons, 100 Watts",$32.93,B00P9QH5US,https://www.amazon.com/Aqueon-100106252-Preset-Heater-100W/dp/B00P9QH5US/ref=sr_1_193?m=A3DQZEP4SGW5UA&qid=1699704050&s=merchant-items&sr=1-193
"Garmin 010-02038-02 DriveSmart 65, Built-In Voice-Controlled GPS Navigator with 6.95” High-Res Display , Black",$32.93,B07MN61RKT,https://www.amazon.com/Garmin-DriveSmart-Traffic-Hands-Free-Information/dp/B07MN61RKT/ref=sr_1_194?m=A3DQZEP4SGW5UA&qid=1699704050&s=merchant-items&sr=1-194
"K&N Premium Oil Filter: Protects your Engine: Compatible with Select INFINITI/MAZDA/NISSAN/SUBARU Vehicle Models (See Product Description for Full List of Compatible Vehicles), HP-1008",$32.93,B000C4087Y,https://www.amazon.com/HP-1008-Performance-Wrench-Off-Oil-Filter/dp/B000C4087Y/ref=sr_1_195?m=A3DQZEP4SGW5UA&qid=1699704050&s=merchant-items&sr=1-195
"APC UPS Battery Replacement RBC17 for APC Models BE650G1, BE750G, BR700G, BE850M2, BE850G2, BX850M, BE650G, BN600, BN700MC, BN900M, and Select Others",$32.93,B0002QLDLC,https://www.amazon.com/APC-Battery-Replacement-BE650G1-RBC17/dp/B0002QLDLC/ref=sr_1_196?m=A3DQZEP4SGW5UA&qid=1699704050&s=merchant-items&sr=1-196
"Canon CLI-251 BK/CMY 4PK Compatible to MG6320, iP7220, MG5420, MX922, MG7120, MG6420, MG5520, iX6820, iP8720, MG7520, MG6620, MG5620",$32.93,B00ATZ9JZI,https://www.amazon.com/Canon-CLI-251-BK-CMY-4PK/dp/B00ATZ9JZI/ref=sr_1_197?m=A3DQZEP4SGW5UA&qid=1699704050&s=merchant-items&sr=1-197
"Samsill Durable .5 Inch Binder, Made in the USA, Round Ring Customizable Clear View Binder, White, 8 Pack (S88417)",$32.93,B00BL3ESU8,https://www.amazon.com/Samsill-Ring-Durable-View-Binders/dp/B00BL3ESU8/ref=sr_1_198?m=A3DQZEP4SGW5UA&qid=1699704050&s=merchant-items&sr=1-198
"Fluker's Sun Dome Reptile Lamp - Deep Dome Flush Mount Light Fixture,White, 5.5 Inches,Black",$32.93,B003I5QNGY,https://www.amazon.com/Flukers-Mini-Dome-Reptile-Lamp/dp/B003I5QNGY/ref=sr_1_199?m=A3DQZEP4SGW5UA&qid=1699704050&s=merchant-items&sr=1-199
"NETGEAR 5-Port Gigabit Ethernet Unmanaged Switch (GS105NA) - Desktop or Wall Mount, and Limited Lifetime Protection",$32.93,B0000BVYT3,https://www.amazon.com/NETGEAR-Ethernet-Unmanaged-Protection-GS105NA/dp/B0000BVYT3/ref=sr_1_200?m=A3DQZEP4SGW5UA&qid=1699704050&s=merchant-items&sr=1-200
"303 Marine Clear Protective Cleaner - Cleans and Protects Vinyl and Plastics, Provides Superior UV Protection, Prevents Yellowing and Cracking, 32oz (30215) Packaging May Vary",$32.93,B00TUNST10,https://www.amazon.com/303-Superior-UV-Vinyl-Protection/dp/B00TUNST10/ref=sr_1_201?m=A3DQZEP4SGW5UA&qid=1699704050&s=merchant-items&sr=1-201
Presto 07046 Tilt 'n Drain Big Griddle Cool-Touch Electric Griddle,$32.93,B00066XROO,https://www.amazon.com/Presto-07046-Griddle-Cool-Touch-Electric/dp/B00066XROO/ref=sr_1_202?m=A3DQZEP4SGW5UA&qid=1699704050&s=merchant-items&sr=1-202
"Canon PGI-250 PGBK Compatible to iP7220,iP8720,iX6820,MG5420,MG5520/MG6420,MG5620/MG6620,MG6320,MG7120,MG7520,MX922/MX722 Printers",$32.93,B00AH9JVJ0,https://www.amazon.com/Canon-PGI-250-PGBK-Compatible-MG5520/dp/B00AH9JVJ0/ref=sr_1_203?m=A3DQZEP4SGW5UA&qid=1699704050&s=merchant-items&sr=1-203
"DERMA-E Stem Cell Lifting Eye Treatment – Multi Action Firming and Tightening Under Eye and Upper Eyelid Cream - Hydrating and Revitalizing Moisturizer, 0.5oz",$32.93,B00XAJI1AE,https://www.amazon.com/DERMA-Stem-Cell-Lifting-Treatment/dp/B00XAJI1AE/ref=sr_1_204?m=A3DQZEP4SGW5UA&qid=1699704050&s=merchant-items&sr=1-204
"TP-Link AC750 Wireless Portable Nano Travel Router(TL-WR902AC) - Support Multiple Modes,Hotspot/Bridge/Range Extender/Access Point/Client Modes, Dual Band WiFi, 1 USB 2.0 Port",$32.93,B01N5RCZQH,https://www.amazon.com/TP-Link-Wireless-Travel-Router-TL-WR902AC/dp/B01N5RCZQH/ref=sr_1_205?m=A3DQZEP4SGW5UA&qid=1699704050&s=merchant-items&sr=1-205
"Tripp Lite SMART1500LCD 1500VA Smart UPS Battery Back Up, 900W Rack-Mount/Tower, LCD, AVR, USB, DB9, 3 Year Warranty & Dollar 250,000 Insurance Black",$32.93,B000DZRY9C,https://www.amazon.com/Tripp-Lite-Battery-Rack-Mount-SMART1500LCD/dp/B000DZRY9C/ref=sr_1_206?m=A3DQZEP4SGW5UA&qid=1699704050&s=merchant-items&sr=1-206
"Cyber Acoustics USB Speaker Bar (CA-2890) – Stereo USB Powered Speaker, Easily Clamps to Monitor, Convenient Controls",$32.93,B09DJ1ZM5W,https://www.amazon.com/Cyber-Acoustics-USB-Speaker-Bar/dp/B09DJ1ZM5W/ref=sr_1_207?m=A3DQZEP4SGW5UA&qid=1699704050&s=merchant-items&sr=1-207
Seachem StressGuard Slime Coat Protection - Stress and Toxic Ammonia Reducer 500 ml,$32.93,B001F0KX06,https://www.amazon.com/Seachem-116052306-StressGuard-500ml/dp/B001F0KX06/ref=sr_1_208?m=A3DQZEP4SGW5UA&qid=1699704050&s=merchant-items&sr=1-208
"Batman 3D Molded 16 inch Backpack (16 Inch, Blue/Black)",$21.25,B07F3B52CH,https://www.amazon.com/Batman-Molded-inch-Backpack-Black/dp/B07F3B52CH/ref=sr_1_209?m=A3DQZEP4SGW5UA&qid=1699704054&s=merchant-items&sr=1-209
Elegant Moments Women's Cupless Lace Mini Dress-Plus Size,$21.25,B0062TWEF2,https://www.amazon.com/HSL8527Q-Vivace-Collection-Elegant-Moments/dp/B0062TWEF2/ref=sr_1_210?m=A3DQZEP4SGW5UA&qid=1699704054&s=merchant-items&sr=1-210
"Mercury Luggage Garment Bag, Black",$21.25,B08V6MTV1Z,https://www.amazon.com/Mercury-Luggage-Garment-Bag-Black/dp/B08V6MTV1Z/ref=sr_1_211?m=A3DQZEP4SGW5UA&qid=1699704054&s=merchant-items&sr=1-211
"Dad to Be Satin Button 2"" Party Accessory",$21.25,B00AVZV8EQ,https://www.amazon.com/Dad-Satin-Button-Party-Accessory/dp/B00AVZV8EQ/ref=sr_1_212?m=A3DQZEP4SGW5UA&qid=1699704054&s=merchant-items&sr=1-212
"Cummins Men Standard Short Sleeve Pocket Tee, Black",$21.25,B0B7DBYM85,https://www.amazon.com/Cummins-Standard-Short-Sleeve-Pocket/dp/B0B7DBYM85/ref=sr_1_213?m=A3DQZEP4SGW5UA&qid=1699704054&s=merchant-items&sr=1-213
"CTW Home Collection 420195 Tractor Boot Scraper, 10-Inch Width, Cast Iron",$21.25,B08WH4SG2L,https://www.amazon.com/CTW-Home-Collection-420195-Tractor/dp/B08WH4SG2L/ref=sr_1_214?m=A3DQZEP4SGW5UA&qid=1699704054&s=merchant-items&sr=1-214
Mapalé 97 Women Underwear Sexy Lingerie Panties Thong Boyhort Cage Panty Mujer,$21.25,B075WZSMZ8,https://www.amazon.com/97-Underwear-Lingerie-Panties-Boyhort/dp/B075WZSMZ8/ref=sr_1_215?m=A3DQZEP4SGW5UA&qid=1699704054&s=merchant-items&sr=1-215
Pink Lipstick All Night Wrong Dress Black,$21.25,B07MZBJB5T,https://www.amazon.com/Pink-Lipstick-Night-Wrong-Dress/dp/B07MZBJB5T/ref=sr_1_216?m=A3DQZEP4SGW5UA&qid=1699704054&s=merchant-items&sr=1-216
WOOD ROCKET Live Laugh Cum Soft Enamel Adult Keychain,$21.25,B0B5NMK3B6,https://www.amazon.com/WOOD-ROCKET-Laugh-Enamel-Keychain/dp/B0B5NMK3B6/ref=sr_1_217?m=A3DQZEP4SGW5UA&qid=1699704054&s=merchant-items&sr=1-217
Elegant Moments Women's Crochet Long Sleeve Mini Dress with Hood,$21.25,B00D6AJ7TG,https://www.amazon.com/Elegant-Moments-Womens-Crochet-Sleeve/dp/B00D6AJ7TG/ref=sr_1_218?m=A3DQZEP4SGW5UA&qid=1699704054&s=merchant-items&sr=1-218
Male Power 443-277 Hocus Pocus Uplift Bong Thong,$21.25,B0BTQ4F9XQ,https://www.amazon.com/Male-Power-443-277-Uplift-XL/dp/B0BTQ4F9XQ/ref=sr_1_219?m=A3DQZEP4SGW5UA&qid=1699704054&s=merchant-items&sr=1-219
Bambini Boy's Six Pack Pastel Tank Top,$21.25,B01D53G2W8,https://www.amazon.com/bambini-Unisex-6-Pack-Sleeveless-T-Shirts/dp/B01D53G2W8/ref=sr_1_220?m=A3DQZEP4SGW5UA&qid=1699704054&s=merchant-items&sr=1-220
Elegant Moments Women's Opaque Thigh Hi with Satin Bow Plus Size,$21.25,B001MXM0CA,https://www.amazon.com/Elegant-Moments-Womens-Opaque-Thigh/dp/B001MXM0CA/ref=sr_1_221?m=A3DQZEP4SGW5UA&qid=1699704054&s=merchant-items&sr=1-221
Smiffys Fever Women's Sienna Long Feathered Wig with Fringe 26” Inches,$21.25,B00DY9DJU2,https://www.amazon.com/Fever-Womens-Feathered-Cherry-26inch/dp/B00DY9DJU2/ref=sr_1_222?m=A3DQZEP4SGW5UA&qid=1699704054&s=merchant-items&sr=1-222
KITBICGSM11BKBOSB310HDS - Value Kit - Stanley Bostitch B310HDS AntiJam Heavy-Duty Stapler (BOSB310HDS) and BIC Round Stic Ballpoint Stick Pen (BICGSM11BK),$21.25,B00MON7702,https://www.amazon.com/KITBICGSM11BKBOSB310HDS-Heavy-Duty-BOSB310HDS-Ballpoint-BICGSM11BK/dp/B00MON7702/ref=sr_1_223?m=A3DQZEP4SGW5UA&qid=1699704054&s=merchant-items&sr=1-223
Cummins Men's Standard Unisex Classic Long Sleeve Sweatshirt,$21.25,B0BGQGR7W8,https://www.amazon.com/Cummins-Unisex-Crewneck-Sweatshirt-CMN5026-2XL/dp/B0BGQGR7W8/ref=sr_1_224?m=A3DQZEP4SGW5UA&qid=1699704054&s=merchant-items&sr=1-224
"Canon PGI-280 XXL Pigment Black Ink Tank, Compatible to: TS8120, TS6120, TR7520, TR8520, TS9120, TS8120",$45.44,B074TQR73H,https://www.amazon.com/Canon-PGI-280-Pigment-Black-Compatible/dp/B074TQR73H/ref=sr_1_225?m=A3DQZEP4SGW5UA&qid=1699704060&s=merchant-items&sr=1-225
Aqueon QuietFlow E Internal Power Filter Extra Small - 3 Gallon,$45.44,B06XW2B39Z,https://www.amazon.com/Aqueon-Quietflow-Internal-Filter-Gallon/dp/B06XW2B39Z/ref=sr_1_226?m=A3DQZEP4SGW5UA&qid=1699704060&s=merchant-items&sr=1-226
"Bondo Fiberglass Resin Repair Kit, 00420, 0.45 Pint",$45.44,B000BO9NOO,https://www.amazon.com/Fiberglass-Repairing-Resurfacing-Rebuilding-Hardener/dp/B000BO9NOO/ref=sr_1_227?m=A3DQZEP4SGW5UA&qid=1699704060&s=merchant-items&sr=1-227
"4"" WHT DRYER VENT WIDE MOUTH",$45.44,B00314WY0G,https://www.amazon.com/WHT-DRYER-VENT-WIDE-MOUTH/dp/B00314WY0G/ref=sr_1_228?m=A3DQZEP4SGW5UA&qid=1699704060&s=merchant-items&sr=1-228
"Brother Tape, Retail Packaging, 3/8 Inch, Black on White (TZe221)",$45.44,B004I2EDA4,https://www.amazon.com/Brother-Retail-Packaging-Black-TZe221/dp/B004I2EDA4/ref=sr_1_229?m=A3DQZEP4SGW5UA&qid=1699704060&s=merchant-items&sr=1-229
"Hot Shot's Secret Diesel Extreme, 1 Qt (Packaging May Vary) (P040432Z) Amber, 32 Fluid Ounce",$45.44,B00IUGFZJW,https://www.amazon.com/Hot-Shots-Secret-P040432Z-Fluid_Ounces/dp/B00IUGFZJW/ref=sr_1_230?m=A3DQZEP4SGW5UA&qid=1699704060&s=merchant-items&sr=1-230
"MSI B550M PRO-VDH WiFi ProSeries Motherboard (AMD AM4, DDR4, PCIe 4.0, SATA 6Gb/s, M.2, USB 3.2 Gen 1, Wi-Fi, D-SUB/HDMI/DP, Micro-ATX)",$45.44,B089D1YG11,https://www.amazon.com/MSI-B550M-PRO-VDH-ProSeries-Motherboard/dp/B089D1YG11/ref=sr_1_231?m=A3DQZEP4SGW5UA&qid=1699704060&s=merchant-items&sr=1-231
"FIRST ALERT AUTO5 Car Fire Extinguisher, FESA5, UL RATED 5-B:C, Red, 1-Pack",$45.44,B000P0DPGQ,https://www.amazon.com/FIRST-ALERT-AUTO5-Auto5-Auto/dp/B000P0DPGQ/ref=sr_1_232?m=A3DQZEP4SGW5UA&qid=1699704060&s=merchant-items&sr=1-232
Flash Furniture Kathryn 5-Foot Granite White Plastic Folding Training Table,$45.44,B008OTR74Q,https://www.amazon.com/Flash-Furniture-Granite-Training-RB-1860-GG/dp/B008OTR74Q/ref=sr_1_233?m=A3DQZEP4SGW5UA&qid=1699704060&s=merchant-items&sr=1-233
Logitech MK850 Performance Wireless Keyboard and Mouse Combo,$45.44,B01NAVO5PF,https://www.amazon.com/Logitech-MK850-Performance-Wireless-Keyboard/dp/B01NAVO5PF/ref=sr_1_234?m=A3DQZEP4SGW5UA&qid=1699704060&s=merchant-items&sr=1-234
"FRAM Extra Guard CA10242 Replacement Engine Air Filter for Select Ford, Lincoln, Mazda, and Mercury Models, Provides Up to 12 Months or 12,000 Miles Filter Protection",$45.44,B001C97ZVA,https://www.amazon.com/CA10242-Extra-Guard-Panel-Filter/dp/B001C97ZVA/ref=sr_1_235?m=A3DQZEP4SGW5UA&qid=1699704060&s=merchant-items&sr=1-235
"Canon PGI-280 Pigment Black Ink Tank Compatible to printer TR8520, TR7520, TS9120 Series,TS8120 Series, TS6120 Series, TS9521C, TS9520, TS8220 Series, TS6220 Series",$45.44,B074TR3F41,https://www.amazon.com/Canon-PGI-280-Pigment-Compatible-Wireless/dp/B074TR3F41/ref=sr_1_236?m=A3DQZEP4SGW5UA&qid=1699704060&s=merchant-items&sr=1-236
"Durex Condom XXL Longer & Wider Natural Latex Condoms, Extra Wide Fit, 12 Count - Ultra Fine & Lubricated (Packaging May Vary)",$45.44,B086194JZ2,https://www.amazon.com/Condoms-Durex-Natural-12Count-Eligible/dp/B086194JZ2/ref=sr_1_237?m=A3DQZEP4SGW5UA&qid=1699704060&s=merchant-items&sr=1-237
MCGARD 24157 Chrome Cone Seat Wheel Locks (M12 x 1.5 Thread Size) - 4 Locks / 1 Key,$45.44,B000CONU1K,https://www.amazon.com/McGard-24157-Chrome-Wheel-Thread/dp/B000CONU1K/ref=sr_1_238?m=A3DQZEP4SGW5UA&qid=1699704060&s=merchant-items&sr=1-238
"Audio-Technica ATH-M30x Professional Studio Monitor Headphones, Black",$45.44,B00HVLUQW8,https://www.amazon.com/Audio-Technica-ATH-M30x-Professional-Monitor-Headphones/dp/B00HVLUQW8/ref=sr_1_239?m=A3DQZEP4SGW5UA&qid=1699704060&s=merchant-items&sr=1-239
"Canon PGI-1200XL Black Compatible to iB4120,MB2120,MB2720,MB5120,MB5420 Printers",$45.44,B00NUWUHIA,https://www.amazon.com/CanonInk-PGI-1200-XL-Black-Pigment/dp/B00NUWUHIA/ref=sr_1_240?m=A3DQZEP4SGW5UA&qid=1699704060&s=merchant-items&sr=1-240
Elegant Moments Women's Opaque Burn Out Halter Mini Dress,$14.68,B002PONW7W,https://www.amazon.com/Opaque-Burn-Halter-Mini-Dress/dp/B002PONW7W/ref=sr_1_241?m=A3DQZEP4SGW5UA&qid=1699704066&s=merchant-items&sr=1-241
Elegant Moments FISHNET THIGH HI WITH LACE GARTERBELT.,$14.68,B001MXEXG6,https://www.amazon.com/FISHNET-THIGH-HI-LACE-GARTERBELT/dp/B001MXEXG6/ref=sr_1_242?m=A3DQZEP4SGW5UA&qid=1699704066&s=merchant-items&sr=1-242
Mapale 104 Micro Mini Shorts,$14.68,B07RGXQ9YF,https://www.amazon.com/Mapale-Micro-Mini-Shorts-Chambray/dp/B07RGXQ9YF/ref=sr_1_243?m=A3DQZEP4SGW5UA&qid=1699704066&s=merchant-items&sr=1-243
Key Chain WHT Floating Life,$14.68,B005Z3YMDI,https://www.amazon.com/Jim-Buoy-88-Floating-Chain-Orange/dp/B005Z3YMDI/ref=sr_1_244?m=A3DQZEP4SGW5UA&qid=1699704066&s=merchant-items&sr=1-244
Outside Inside 99929 Backpack Checkerboard,$14.68,B081DPMN5P,https://www.amazon.com/Outside-Inside-99929-Backpack-Checkerboard/dp/B081DPMN5P/ref=sr_1_245?m=A3DQZEP4SGW5UA&qid=1699704066&s=merchant-items&sr=1-245
Rene Rofe Women's Hollywood Chemise and G-String Set,$14.68,B008OQTR24,https://www.amazon.com/Rene-Rofe-Hollywood-Chemise-G-String/dp/B008OQTR24/ref=sr_1_246?m=A3DQZEP4SGW5UA&qid=1699704066&s=merchant-items&sr=1-246
"WirthCo 32251 Clip On Spout (With Clip Strip Card Retail Package), 1 Pack, Multi",$14.68,B000CQDRV6,https://www.amazon.com/WirthCo-32251-Spout-Retail-Package/dp/B000CQDRV6/ref=sr_1_247?m=A3DQZEP4SGW5UA&qid=1699704066&s=merchant-items&sr=1-247
Maretron FA-NM-ST Male Mini Straight Field Connector,$14.68,B0043K5AEO,https://www.amazon.com/Maretron-FA-NM-ST-Straight-Field-Connector/dp/B0043K5AEO/ref=sr_1_248?m=A3DQZEP4SGW5UA&qid=1699704066&s=merchant-items&sr=1-248
"Dipsters Disposable Patientwear / Swimwear, Women's Halter Top and Bikini, Medium (12 Pack)",$14.68,B00BRCHC74,https://www.amazon.com/Dipsters-Disposable-Patientwear-Swimwear-Womens/dp/B00BRCHC74/ref=sr_1_249?m=A3DQZEP4SGW5UA&qid=1699704066&s=merchant-items&sr=1-249
"Woodland Scenics Flowering Foliage Bag, Purple/100 sq. in.",$14.68,B000BL8JNS,https://www.amazon.com/Woodland-Scenics-Flowering-Foliage-Inches-Purple/dp/B000BL8JNS/ref=sr_1_250?m=A3DQZEP4SGW5UA&qid=1699704066&s=merchant-items&sr=1-250
Coquette Women's Wet Look Cross Triangle Top with Leg Harness Set,$14.68,B07WZH95F2,https://www.amazon.com/Coquette-Womens-Triangle-Harness-X-Large/dp/B07WZH95F2/ref=sr_1_251?m=A3DQZEP4SGW5UA&qid=1699704066&s=merchant-items&sr=1-251
"Avid Products AE-55 Headset with 3.5mm Plug (Black, Silver)",$14.68,B095HM7LVQ,https://www.amazon.com/AE-55-Headest-Black-Silver/dp/B095HM7LVQ/ref=sr_1_252?m=A3DQZEP4SGW5UA&qid=1699704066&s=merchant-items&sr=1-252
Elegant Moments Women's Long Sleeve Hooded Dress,$14.68,B00JYNGIQ4,https://www.amazon.com/Elegant-Moments-Womens-Sleeve-Hooded/dp/B00JYNGIQ4/ref=sr_1_253?m=A3DQZEP4SGW5UA&qid=1699704066&s=merchant-items&sr=1-253
Bambini 3220 W White Thermal Receiving Blanket 30 x 40 in.,$14.68,B01LX268C9,https://www.amazon.com/Bambini-White-Thermal-Receiving-Blanket44/dp/B01LX268C9/ref=sr_1_254?m=A3DQZEP4SGW5UA&qid=1699704066&s=merchant-items&sr=1-254
"Mercury 20 Inch Value Upright, Black",$14.68,B07BTJJTGB,https://www.amazon.com/Mercury-Inch-Value-Upright-Black/dp/B07BTJJTGB/ref=sr_1_255?m=A3DQZEP4SGW5UA&qid=1699704066&s=merchant-items&sr=1-255
Pink Lipstick Follow Me Keyhole Mini Dress,$14.68,B0935NG6WB,https://www.amazon.com/Pink-Lipstick-Follow-Keyhole-Dress/dp/B0935NG6WB/ref=sr_1_256?m=A3DQZEP4SGW5UA&qid=1699704066&s=merchant-items&sr=1-256
"DERMA E Microdermabrasion Scrub with Dead Sea Salt & Citrus Essential Oils – Facial Exfoliating Scrub Smooths, Revitalizes and Renews – Ideal for Scars and Wrinkles, 2oz",$39.82,B0000CCW1N,https://www.amazon.com/DERMA-Microdermabrasion-Scrub-Dead-Salt/dp/B0000CCW1N/ref=sr_1_257?m=A3DQZEP4SGW5UA&qid=1699704071&s=merchant-items&sr=1-257
"Soothing Touch 304892-06-LE128 Unscented Jojoba Massage Lotion, Arnica Flower, Aloe Vera, Deeply Moisturizing, 1 Gallon",$39.82,B00GYR9090,https://www.amazon.com/Soothing-Touch-Unscented-Jojoba-Massage/dp/B00GYR9090/ref=sr_1_258?m=A3DQZEP4SGW5UA&qid=1699704071&s=merchant-items&sr=1-258
"Brother Genuine LC3033BK, Single Pack Super High-Yield Black INKvestment Tank Ink Cartridge, Page Yield Upto 3,000 Pages, LC3033, Amazon Dash Replenishment Cartridge",$39.82,B07DB1MGKH,https://www.amazon.com/Brother-LC3033BK-High-Yield-INKvestment-Replenishment/dp/B07DB1MGKH/ref=sr_1_259?m=A3DQZEP4SGW5UA&qid=1699704071&s=merchant-items&sr=1-259
"Brother Genuine P-touch M-2312PK Tape, 2 Pack, 1/2"" (0.47"") Wide Standard Non-Laminated Tape, Black on White, Recommended for Home and Indoor Use, 0.47"" x 26.2' (12mm x 8M), 2-Pack, M2312PK, M231",$39.82,B00VXY3PX6,https://www.amazon.com/Brother-M-2312PK-Non-Laminated-Recommended-M2312PK/dp/B00VXY3PX6/ref=sr_1_260?m=A3DQZEP4SGW5UA&qid=1699704071&s=merchant-items&sr=1-260
"Uniden Bearcat BC125AT Handheld Scanner, 500-Alpha-Tagged Channels, Close Call Technology, PC Programable, Aviation, Marine, Railroad, NASCAR, Racing, and Non-Digital Police/Fire/Public Safety.",$39.82,B00772MR0K,https://www.amazon.com/Uniden-BC125AT-Alpha-Tagged-channels-Lightweight/dp/B00772MR0K/ref=sr_1_261?m=A3DQZEP4SGW5UA&qid=1699704071&s=merchant-items&sr=1-261
"EPSON 200 DURABrite Ultra Ink Standard Capacity Black & Color Cartridge Combo Pack (T200120-BCS) Works with WorkForce WF-2520, WF-2530, WF-2540, Expression XP-200, XP-300, XP-310, XP-400, XP-410",$39.82,B00IS76N94,https://www.amazon.com/Epson-DURABrite-Original-Cartridge-T200120-BCS/dp/B00IS76N94/ref=sr_1_262?m=A3DQZEP4SGW5UA&qid=1699704071&s=merchant-items&sr=1-262
"Camco RhinoFLEX Camper/RV Swivel Fitting Wrench Set | Disconnect/Connect Sewer Fittings with Ease | Ergonomic Design & Compatible w/Rhino, Revolution & Easy Slip RV Sewer Hose Fittings | 2-Pk (39758)",$39.82,B00OJHPQSQ,https://www.amazon.com/Camco-39758-Rhinoflex-Fitting-Wrench/dp/B00OJHPQSQ/ref=sr_1_263?m=A3DQZEP4SGW5UA&qid=1699704071&s=merchant-items&sr=1-263
"Canon CL-276 Color Ink Cartridge, Compatible to PIXMA TS3520, TS3522 and TR4720 Printers",$39.82,B08XZQ4ZSN,https://www.amazon.com/Canon-4988C001-CL-276-AMR/dp/B08XZQ4ZSN/ref=sr_1_264?m=A3DQZEP4SGW5UA&qid=1699704071&s=merchant-items&sr=1-264
"HP USB-C Dock G5-8 in 1 Adapter for Both USB-C and Thunderbolt-Enabled Laptops, PCs, & Notebooks - Single Cable for Charging, Networking, or Data Transfers - Great for Secure & Remote Management",$39.82,B08TQPTPCK,https://www.amazon.com/HP-USB-C-Dock-Thunderbolt-Enabled-Networking/dp/B08TQPTPCK/ref=sr_1_265?m=A3DQZEP4SGW5UA&qid=1699704071&s=merchant-items&sr=1-265
"WD_BLACK 2TB P10 Game Drive - Portable External Hard Drive HDD, Compatible with Playstation, Xbox, PC, & Mac - WDBA2W0020BBK-WESN",$39.82,B07VMTNDMK,https://www.amazon.com/WD_Black-Drive-External-Compatible-WDBA2W0020BBK-WESN/dp/B07VMTNDMK/ref=sr_1_266?m=A3DQZEP4SGW5UA&qid=1699704071&s=merchant-items&sr=1-266
"Trojan Bareskin Condoms, Everythin Variety Pack, 10 Count",$39.82,B0B6YNSJB4,https://www.amazon.com/Trojan-Bareskin-Condoms-Everythin-Variety/dp/B0B6YNSJB4/ref=sr_1_267?m=A3DQZEP4SGW5UA&qid=1699704071&s=merchant-items&sr=1-267
"Remington SPF-PF Replacement Head and Cutter Assembly for Model PF7400, PF7500, and PF7600 Foil Shavers",$39.82,B00YYVO6VA,https://www.amazon.com/Remington-SPF-PF-Replacement-Assembly-Shavers/dp/B00YYVO6VA/ref=sr_1_268?m=A3DQZEP4SGW5UA&qid=1699704071&s=merchant-items&sr=1-268
Aqueon QuietFlow LED PRO Ammonia Reducer 4 Count Filter Pads for Model 20 and 75,$39.82,B01MDUIPNK,https://www.amazon.com/Aqueon-Ammonia-Reducing-Specialty-Filter/dp/B01MDUIPNK/ref=sr_1_269?m=A3DQZEP4SGW5UA&qid=1699704071&s=merchant-items&sr=1-269
"HyperX CloudX Stinger Core - Official Licensed for Xbox, Gaming Headset with In-Line Audio Control, Immersive In-Game , Microphone",$39.82,B07KYC1VL7,https://www.amazon.com/HyperX-CloudX-Stinger-Core-HX-HSCSCX-BK/dp/B07KYC1VL7/ref=sr_1_270?m=A3DQZEP4SGW5UA&qid=1699704071&s=merchant-items&sr=1-270
"STAR BRITE Instant Hull Cleaner - 32 Oz Gel Spray - Easily Remove Stains, Scum Lines & Grime on Boat Hulls, Fiberglass, Plastic & Painted Surfaces - Easy to Use Formula (096132)",$39.82,B00Z9N4WC0,https://www.amazon.com/Star-brite-Hull-Cleaner-Spray/dp/B00Z9N4WC0/ref=sr_1_271?m=A3DQZEP4SGW5UA&qid=1699704071&s=merchant-items&sr=1-271
Sharp EL-1197PIII Heavy Duty Color Printing Calculator with Clock and Calendar,$39.82,B00005BIEF,https://www.amazon.com/Sharp-EL-1197PIII-Printing-Calculator-Calendar/dp/B00005BIEF/ref=sr_1_272?m=A3DQZEP4SGW5UA&qid=1699704071&s=merchant-items&sr=1-272
Pleated Mini Skirt with Side Zipper,$15.83,B00BB5ZI5K,https://www.amazon.com/Elegant-Moments-Womens-Pleated-Turquoise/dp/B00BB5ZI5K/ref=sr_1_273?m=A3DQZEP4SGW5UA&qid=1699704078&s=merchant-items&sr=1-273
Coquette 85570: Open Back Fishnet Pantyhose Blk Os,$15.83,B0BVRT7VRY,https://www.amazon.com/Coquette-Womens-Black-Pantyhose-Lingerie/dp/B0BVRT7VRY/ref=sr_1_274?m=A3DQZEP4SGW5UA&qid=1699704078&s=merchant-items&sr=1-274
"Mobile Edge Smartpack 15.6 Inch Laptop Backpack with Separate Padded Tablet Compartment Crimson Lightweight Red for Men, Women, MEBPSP7, Crimson Red",$15.83,B019L9Z6RW,https://www.amazon.com/Mobile-edge-Me-Slipsuit-Sleeve/dp/B019L9Z6RW/ref=sr_1_275?m=A3DQZEP4SGW5UA&qid=1699704078&s=merchant-items&sr=1-275
womens Raspberry Chemise & G-string Set,$15.83,B0BVRV477L,https://www.amazon.com/Coquette-Womens-Raspberry-G-string-Chemise/dp/B0BVRV477L/ref=sr_1_276?m=A3DQZEP4SGW5UA&qid=1699704078&s=merchant-items&sr=1-276
Garter Halter Teddy with Wired Cups & Stockings - O/S,$15.83,B09NRYCH19,https://www.amazon.com/World-Intimates-Stockings-Strawberry-Daiquiri/dp/B09NRYCH19/ref=sr_1_277?m=A3DQZEP4SGW5UA&qid=1699704078&s=merchant-items&sr=1-277
Strappy Garter Teddy w/Keyhole Cups & Stockings Red O/S,$15.83,B0BS65Z4DF,https://www.amazon.com/Strappy-Garter-Teddy-Keyhole-Stockings/dp/B0BS65Z4DF/ref=sr_1_278?m=A3DQZEP4SGW5UA&qid=1699704078&s=merchant-items&sr=1-278
Rene Rofe Queen of Hearts Tube Dress Red O/s,$15.83,B0859LFSFV,https://www.amazon.com/Rene-Rofe-Queen-Hearts-Dress/dp/B0859LFSFV/ref=sr_1_279?m=A3DQZEP4SGW5UA&qid=1699704078&s=merchant-items&sr=1-279
womens Cross-shaped Pasties,$15.83,B09W447NMH,https://www.amazon.com/Coquette-22116-Cross-Shaped-Pasties/dp/B09W447NMH/ref=sr_1_280?m=A3DQZEP4SGW5UA&qid=1699704078&s=merchant-items&sr=1-280
BigMouth Inc. 22-BSS-3908 Mermaid Tail Saddle Seat Float,$15.83,B09JVND1TB,https://www.amazon.com/BigMouth-Mermaid-Saddle-Multi-Large/dp/B09JVND1TB/ref=sr_1_281?m=A3DQZEP4SGW5UA&qid=1699704078&s=merchant-items&sr=1-281
Case Logic VNB-217BLACK Value 17-Inch Laptop Backpack (Black),$15.83,B002J9HBSE,https://www.amazon.com/Case-Logic-VNB-217BLACK-17-Inch-Backpack/dp/B002J9HBSE/ref=sr_1_282?m=A3DQZEP4SGW5UA&qid=1699704078&s=merchant-items&sr=1-282
Allstar Performance ALL23075 Flexible Body Brace,$15.83,B00JQW46QW,https://www.amazon.com/Allstar-Performance-ALL23075-Flexible-Brace/dp/B00JQW46QW/ref=sr_1_283?m=A3DQZEP4SGW5UA&qid=1699704078&s=merchant-items&sr=1-283
Women's Footless Stocking Red,$15.83,B09TTQZR6Z,https://www.amazon.com/Coquette-womens-Footless-Stocking-X-Large-Queen/dp/B09TTQZR6Z/ref=sr_1_284?m=A3DQZEP4SGW5UA&qid=1699704078&s=merchant-items&sr=1-284
"Rene Rofe 4 Pc Sweet Mary Jane White O/s, One Size",$15.83,B09FTN97RV,https://www.amazon.com/Rene-Rofe-Sweet-Mary-White/dp/B09FTN97RV/ref=sr_1_285?m=A3DQZEP4SGW5UA&qid=1699704078&s=merchant-items&sr=1-285
Sheer Lace Babydoll Teddy & Lace Leg Garters - O/S,$15.83,B09NRX77VW,https://www.amazon.com/World-Intimates-Sheer-Babydoll-Garters/dp/B09NRX77VW/ref=sr_1_286?m=A3DQZEP4SGW5UA&qid=1699704078&s=merchant-items&sr=1-286
"Amber Fight GearUltimateGym Bag Duffle Mesh Bags Workout Bag Gym Bagfor Boxing, MMA, Kickboxing Wrestling, or Active Athlete Bag. It’s a Breathable Duffel Bag for Sweaty Clothes and Equipment. 26”",$15.83,B09X1VXX7G,https://www.amazon.com/Amber-Fight-GearUltimateGym-Kickboxing-Breathable/dp/B09X1VXX7G/ref=sr_1_287?m=A3DQZEP4SGW5UA&qid=1699704078&s=merchant-items&sr=1-287
White Tank Top 6 Pack,$15.83,B0747W3W65,https://www.amazon.com/Bambini-White-Tank-Top-Pack/dp/B0747W3W65/ref=sr_1_288?m=A3DQZEP4SGW5UA&qid=1699704078&s=merchant-items&sr=1-288
"MSI Force GC30V2 Wireless Gaming Controller, Dual Vibration Motors, Dual Connection Modes, Interchangable D-Pads, Compatible with PC & Android",$55.28,B09PFBX39L,https://www.amazon.com/MSI-Force-Controller-Connection-Interchangable/dp/B09PFBX39L/ref=sr_1_289?m=A3DQZEP4SGW5UA&qid=1699704081&s=merchant-items&sr=1-289
Zerex Asian Vehicle Red Silicate and Borate Free 50/50 Prediluted Ready-to-Use Antifreeze/Coolant 1 GA,$55.28,B0033QO022,https://www.amazon.com/Zerex-Asian-Antifreeze-Coolant-Ready/dp/B0033QO022/ref=sr_1_290?m=A3DQZEP4SGW5UA&qid=1699704081&s=merchant-items&sr=1-290
Trojan Double Ecstasy Lubricated Condoms - 10 Count,$55.28,B00HRU9YDU,https://www.amazon.com/Trojan-Double-Ecstasy-Lubricated-Condoms/dp/B00HRU9YDU/ref=sr_1_291?m=A3DQZEP4SGW5UA&qid=1699704081&s=merchant-items&sr=1-291
